{"type":"config","name":"agent-ui-human-e2e","metricName":"ui_composite_score","metricUnit":"","bestDirection":"higher"}
{"run":1,"commit":"a87bf44","metric":85,"metrics":{"workflow_success_rate":1,"typed_success_rate":1,"voice_success_rate":1,"shortcut_to_modal_p95_ms":532,"modal_focus_success_rate":1,"submit_to_cat_visible_p95_ms":664,"first_output_to_bubble_p95_ms":121,"terminal_to_visual_p95_ms":0,"oracle_pass_rate":1,"cleanup_success_rate":1},"status":"keep","description":"Baseline scoped serial chrome-pdf-to-anki-study-pack run on existing human E2E implementation","timestamp":1777658407302,"segment":0,"confidence":null,"asi":{"hypothesis":"Establish a clean pi-autoresearch baseline using the approved scoped serial scenario before changing code.","benchmark_scope":"AGENT_UI_E2E_SCENARIOS=chrome-pdf-to-anki-study-pack AGENT_UI_E2E_MODE=serial","baseline_note":"Checks passed; ui_composite_score is already capped at 85 for this scenario, so future improvements likely need new coverage/metrics or lower latency secondary metrics."}}
{"run":2,"commit":"a87bf44","metric":42.5,"metrics":{"workflow_success_rate":0,"typed_success_rate":0,"voice_success_rate":1,"shortcut_to_modal_p95_ms":520,"modal_focus_success_rate":1,"submit_to_cat_visible_p95_ms":0,"first_output_to_bubble_p95_ms":0,"terminal_to_visual_p95_ms":0,"oracle_pass_rate":0,"cleanup_success_rate":1},"status":"discard","description":"Spawn overlay cat before pointer-context wait to reduce submit-to-visible latency","timestamp":1777658575659,"segment":0,"confidence":null,"asi":{"hypothesis":"Decoupling overlay spawn from pointer-context capture would make the cat visible immediately while delaying only Hermes startup.","rollback_reason":"Benchmark lost the run/conversation: oracle_pass_rate and workflow_success_rate dropped to 0, with no visible output metrics. The overlay spawn path depends on conversation/run setup ordering more than expected.","next_action_hint":"Try a safer split: create/register the conversation before sending spawn-cat, or optimize pointer capture itself rather than moving spawn before startAgentForCat."}}
{"run":3,"commit":"a87bf44","metric":85,"metrics":{"workflow_success_rate":1,"typed_success_rate":1,"voice_success_rate":1,"shortcut_to_modal_p95_ms":515,"modal_focus_success_rate":1,"submit_to_cat_visible_p95_ms":668,"first_output_to_bubble_p95_ms":121,"terminal_to_visual_p95_ms":0,"oracle_pass_rate":1,"cleanup_success_rate":1},"status":"discard","description":"Measure submit-to-visible from UI target cat count before waiting for conversation registration","timestamp":1777658969024,"segment":0,"confidence":null,"asi":{"hypothesis":"The submit latency metric was inflated by waiting for conversation registration; counting visible cat targets first would reveal the true overlay latency and improve the primary latency component.","rollback_reason":"Primary score stayed at 85 and submit_to_cat_visible_p95_ms stayed ~668ms, indicating visible cat target count also does not increase before the delayed registration path in the current implementation.","next_action_hint":"Focus on actual ordering: move conversation registration ahead of slow snapshot/artifact work or reduce the pre-spawn delay in startCatRunFromPayload/runAgentLifecycle."}}
{"run":4,"commit":"a87bf44","metric":85,"metrics":{"workflow_success_rate":1,"typed_success_rate":1,"voice_success_rate":1,"shortcut_to_modal_p95_ms":513,"modal_focus_success_rate":1,"submit_to_cat_visible_p95_ms":663,"first_output_to_bubble_p95_ms":121,"terminal_to_visual_p95_ms":1,"oracle_pass_rate":1,"cleanup_success_rate":1},"status":"discard","description":"Register conversation before git snapshot capture to reduce submit-to-visible delay","timestamp":1777659270003,"segment":0,"confidence":null,"asi":{"hypothesis":"Moving conversation registration ahead of snapshot capture would unblock visible cat creation sooner while preserving revert metadata after snapshot completes.","rollback_reason":"Primary score did not improve and submit_to_cat_visible_p95_ms remained ~663ms; snapshot capture is not the dominant measured delay in this scoped case.","next_action_hint":"User emphasized input latency and visible text/state correctness. Instrument pre-submit typing/focus path and visible text at every state before trying more submit-path changes."}}
{"type":"config","name":"agent-ui-human-e2e-input-latency-visible-text","metricName":"ui_composite_score","metricUnit":"","bestDirection":"higher"}
{"run":5,"commit":"8fa6fc7","metric":85,"metrics":{"workflow_success_rate":1,"typed_success_rate":1,"voice_success_rate":1,"shortcut_to_modal_p95_ms":514,"modal_focus_success_rate":1,"submit_to_cat_visible_p95_ms":648,"prompt_input_p95_ms":17821,"prompt_chars_per_sec":12.17664553055384,"prompt_visible_match_rate":1,"visible_text_state_pass_rate":1,"first_output_to_bubble_p95_ms":124,"terminal_to_visual_p95_ms":1,"oracle_pass_rate":1,"cleanup_success_rate":1},"status":"keep","description":"Rebaseline after user-requested input-latency and visible-text instrumentation","timestamp":1777659689169,"segment":1,"confidence":null,"asi":{"hypothesis":"Add durable measurement of slow prompt input and verify the text actually visible to the user at input/submit/finish states before optimizing further.","user_feedback":"User reported the test takes a long time to input into agent-UI and asked to focus on latency/speed/performance at each step plus what text is actually shown to the user.","finding":"New prompt_input_p95_ms is 17821ms for the scoped typed scenario (~12.2 chars/sec), confirming input injection is a major benchmark/user-flow bottleneck. Visible prompt text matched expected text and state snapshots passed."}}
{"run":6,"commit":"8fa6fc7","metric":85,"metrics":{"workflow_success_rate":1,"typed_success_rate":1,"voice_success_rate":1,"shortcut_to_modal_p95_ms":539,"modal_focus_success_rate":1,"submit_to_cat_visible_p95_ms":644,"prompt_input_p95_ms":15741,"prompt_chars_per_sec":13.785655295089258,"prompt_visible_match_rate":1,"visible_text_state_pass_rate":1,"first_output_to_bubble_p95_ms":124,"terminal_to_visual_p95_ms":0,"oracle_pass_rate":1,"cleanup_success_rate":1},"status":"discard","description":"Chunk Unicode CGEvents for faster prompt input injection","timestamp":1777660112475,"segment":1,"confidence":null,"asi":{"hypothesis":"Posting Unicode text in chunks instead of key-tapping every character would reduce the long modal input phase while preserving real CGEvent input and visible prompt verification.","rollback_reason":"Primary ui_composite_score did not improve. Secondary prompt_input_p95_ms improved only modestly from 17821ms to 15741ms, suggesting chunked PID text either falls through retry attempts or Electron still throttles text input.","next_action_hint":"Instrument which typePromptText attempt succeeds; try the global HID Unicode path before postToPid, because current ordered attempts may spend 4s timeouts on failing PID-targeted chunk input."}}
{"type":"config","name":"agent-ui-prompt-input-latency-visible-text","metricName":"prompt_input_p95_ms","metricUnit":"ms","bestDirection":"lower"}
{"run":7,"commit":"51a7132","metric":18057,"metrics":{"ui_composite_score":85,"workflow_success_rate":1,"typed_success_rate":1,"voice_success_rate":1,"shortcut_to_modal_p95_ms":511,"modal_focus_success_rate":1,"submit_to_cat_visible_p95_ms":667,"prompt_chars_per_sec":12.017500138450464,"prompt_visible_match_rate":1,"visible_text_state_pass_rate":1,"first_output_to_bubble_p95_ms":122,"terminal_to_visual_p95_ms":0,"oracle_pass_rate":1,"cleanup_success_rate":1},"status":"keep","description":"Baseline prompt input latency target after user feedback","timestamp":1777660605860,"segment":2,"confidence":null,"asi":{"hypothesis":"Use prompt_input_p95_ms as the primary target because user specifically flagged slow input and requested per-step latency plus visible text verification.","finding":"Clean scoped baseline shows prompt entry takes ~18.1s while visible text correctness passes, making the input injector/order the next bottleneck."}}
{"run":8,"commit":"8dc7e16","metric":4406,"metrics":{"ui_composite_score":85,"workflow_success_rate":1,"typed_success_rate":1,"voice_success_rate":1,"shortcut_to_modal_p95_ms":490,"modal_focus_success_rate":1,"submit_to_cat_visible_p95_ms":646,"prompt_chars_per_sec":49.25102133454381,"prompt_visible_match_rate":1,"visible_text_state_pass_rate":1,"first_output_to_bubble_p95_ms":125,"terminal_to_visual_p95_ms":0,"oracle_pass_rate":1,"cleanup_success_rate":1},"status":"keep","description":"Try global HID typing first and record input-attempt diagnostics","timestamp":1777660918626,"segment":2,"confidence":null,"asi":{"hypothesis":"The slow input path was caused by waiting through PID-targeted typing retries; putting the focused global HID path first should type into the real modal faster and still verify visible prompt text.","finding":"prompt_input_p95_ms improved from 18057ms to 4406ms (~4.1x faster). The successful attempt was global-hid on the first try; prompt_visible_match_rate and visible_text_state_pass_rate stayed 1.","visible_text_note":"State snapshots now preserve modal labels, prompt preview/length, cat count after submit, and finish visibility so future runs can debug what the user actually saw at each step."}}
{"run":9,"commit":"fa7ae58","metric":2442,"metrics":{"ui_composite_score":85,"workflow_success_rate":1,"typed_success_rate":1,"voice_success_rate":1,"shortcut_to_modal_p95_ms":518,"modal_focus_success_rate":1,"submit_to_cat_visible_p95_ms":666,"prompt_chars_per_sec":88.86158886158886,"prompt_visible_match_rate":1,"visible_text_state_pass_rate":1,"first_output_to_bubble_p95_ms":121,"terminal_to_visual_p95_ms":1,"oracle_pass_rate":1,"cleanup_success_rate":1},"status":"keep","description":"Combine modal focus, select-all, clear, and typing into one human-input command","timestamp":1777661348020,"segment":2,"confidence":7.95061099796334,"asi":{"hypothesis":"The remaining input delay was repeated Swift process startup and separate activate/click/clear/type commands; combining them should preserve real modal typing while removing harness overhead.","finding":"prompt_input_p95_ms improved from 4406ms to 2442ms, successful on combined-replace-global-hid first attempt. Visible text and workflow/oracle correctness remained perfect.","next_action_hint":"Further gains likely require reducing built-in sleeps in HumanInput.swift or posting text in a shorter burst, but keep prompt_visible_match_rate/visible_text_state_pass_rate at 1."}}
{"run":10,"commit":"2b1eb4f","metric":1805,"metrics":{"ui_composite_score":88.44999999999999,"workflow_success_rate":1,"typed_success_rate":1,"voice_success_rate":1,"shortcut_to_modal_p95_ms":162,"modal_focus_success_rate":1,"submit_to_cat_visible_p95_ms":311,"prompt_chars_per_sec":120.22160664819945,"prompt_visible_match_rate":1,"visible_text_state_pass_rate":1,"first_output_to_bubble_p95_ms":123,"terminal_to_visual_p95_ms":0,"oracle_pass_rate":1,"cleanup_success_rate":1},"status":"keep","description":"Compile HumanInput once per run to reduce per-step input command startup latency","timestamp":1777661659784,"segment":2,"confidence":12.49673202614379,"asi":{"hypothesis":"Repeated `swift` interpretation adds latency to every human input action; compiling HumanInput once per run should improve shortcut, typing, and submit timings without changing UI behavior.","finding":"prompt_input_p95_ms improved from 2442ms to 1805ms and composite rose to 88.45. shortcut_to_modal improved to 162ms and submit_to_cat_visible to 311ms, likely because all input helper invocations are faster.","user_feedback":"User now asks to inspect what is actually shown in UI for conversation steps/agent output; current snapshots only cover modal, submit, finish cat visibility and not open conversation text."}}
{"run":11,"commit":"2b1eb4f","metric":1904,"metrics":{"ui_composite_score":88.6,"workflow_success_rate":1,"typed_success_rate":1,"voice_success_rate":1,"shortcut_to_modal_p95_ms":156,"modal_focus_success_rate":1,"submit_to_cat_visible_p95_ms":308,"prompt_chars_per_sec":113.97058823529412,"prompt_visible_match_rate":1,"visible_text_state_pass_rate":0,"first_output_to_bubble_p95_ms":122,"terminal_to_visual_p95_ms":0,"oracle_pass_rate":1,"cleanup_success_rate":1},"status":"discard","description":"Open conversation window during E2E and validate visible agent/user text states","timestamp":1777662081008,"segment":2,"confidence":25.513343799058084,"asi":{"hypothesis":"Opening the real conversation window and snapshotting visible user/agent text would answer what the user actually sees during the flow.","rollback_reason":"Primary prompt_input_p95_ms regressed slightly from 1805ms to 1904ms and visible conversation assertions failed: conversation_output_visible_rate=0, visible_text_state_pass_rate=0. The click/open path or timing did not capture conversation content reliably.","next_action_hint":"Read Hermes gateway output docs as requested, then implement conversation visible-text parsing with knowledge of Hermes output events. Prefer app-side/eval target instrumentation for conversation DOM contents over brittle cat clicking if needed.","user_feedback":"User asked to inspect what is actually shown in UI for conversation steps/agent output and then pointed to Hermes gateway internals output format docs."}}
{"run":12,"commit":"cf8c3dd","metric":1933,"metrics":{"ui_composite_score":88.325,"workflow_success_rate":1,"typed_success_rate":1,"voice_success_rate":1,"shortcut_to_modal_p95_ms":167,"modal_focus_success_rate":1,"submit_to_cat_visible_p95_ms":302,"prompt_chars_per_sec":112.26073460941541,"prompt_visible_match_rate":1,"visible_text_state_pass_rate":1,"first_output_to_bubble_p95_ms":120,"terminal_to_visual_p95_ms":1,"oracle_pass_rate":1,"cleanup_success_rate":1},"status":"keep","description":"Capture rendered conversation lines and keep prompt input fast with real visible transcript checks","timestamp":1777663070310,"segment":2,"confidence":48.8048048048048,"asi":{"hypothesis":"Hermes chat -q --quiet emits only the final response text to stdout and session_id to stderr, so the benchmark should validate the UI against rendered conversation lines rather than noisy live tool previews.","hermes_output_format":"Verified from docs/code: quiet mode suppresses banner/spinner/tool previews; chat streaming uses response-box text, while oneshot prints only final response. For our benchmark path the assistant transcript is plain stdout final text plus stderr session_id, which the conversation window should render as user + agent lines.","finding":"prompt_input_p95_ms improved to 1933ms and visible_text_state_pass_rate recovered to 1 after capturing actual conversation line entries from the rendered UI. The visible transcript now reflects the user prompt and agent output instead of just raw geometry."}}
{"run":13,"commit":"523b0a0","metric":0,"metrics":{"ui_composite_score":0,"workflow_success_rate":0,"typed_success_rate":0,"voice_success_rate":0,"shortcut_to_modal_p95_ms":0,"modal_focus_success_rate":0,"submit_to_cat_visible_p95_ms":0,"prompt_chars_per_sec":0,"prompt_visible_match_rate":0,"visible_text_state_pass_rate":0,"first_output_to_bubble_p95_ms":0,"terminal_to_visual_p95_ms":0,"oracle_pass_rate":0,"cleanup_success_rate":0},"status":"crash","description":"Rewrite scenario prompts for more natural visible-user wording","timestamp":1777693123603,"segment":2,"confidence":48.8048048048048,"asi":{"hypothesis":"Use more realistic prompt phrasing like 'look at the Chrome page and PDF about X and Y' so benchmark text matches how a user would actually ask the app.","rollback_reason":"The edit introduced a JavaScript syntax error in eval/human-e2e/run.js (missing comma after the release transcript string), so the benchmark could not start.","next_action_hint":"Reapply the prompt wording change with syntax validation before rerunning the benchmark.","error":"node -c eval/human-e2e/run.js failed: Unexpected identifier 'setup' at the release scenario block."}}
{"run":14,"commit":"523b0a0","metric":0,"metrics":{"ui_composite_score":88.37499999999999,"workflow_success_rate":1,"typed_success_rate":1,"voice_success_rate":1,"shortcut_to_modal_p95_ms":165,"modal_focus_success_rate":1,"submit_to_cat_visible_p95_ms":303,"prompt_chars_per_sec":229.19042189281643,"prompt_visible_match_rate":1,"visible_text_state_pass_rate":1,"first_output_to_bubble_p95_ms":122,"terminal_to_visual_p95_ms":0,"oracle_pass_rate":1,"cleanup_success_rate":1},"status":"crash","description":"Full serial suite timed out while validating the Codex-style pet shell","timestamp":1777696610839,"segment":2,"confidence":48.8048048048048,"asi":{"hypothesis":"A Codex-like floating pet shell with row-based sessions should preserve concurrency while making the UI glanceable and quicker to render.","rollback_reason":"The full serial benchmark timed out before completion; the timeout appears to be benchmark-duration related rather than a functional regression, so code was treated as inconclusive/crash for the full-suite run.","next_action_hint":"Reapply the UI patch if reverted, then either shorten the full-suite workload or continue with the scoped serial scenario for latency confirmation.","benchmark_scope":"AGENT_UI_E2E_MODE=serial ./autoresearch.sh (full suite timed out after 900s)","scoped_confirmation":"AGENT_UI_E2E_SCENARIOS=chrome-pdf-to-anki-study-pack AGENT_UI_E2E_MODE=serial produced ui_composite_score=88.37 and submit_to_cat_visible_p95_ms=303ms"}}
{"run":15,"commit":"9865ef3","metric":88.4,"metrics":{"ui_composite_score":88.4,"workflow_success_rate":1,"typed_success_rate":1,"voice_success_rate":1,"shortcut_to_modal_p95_ms":164,"modal_focus_success_rate":1,"submit_to_cat_visible_p95_ms":289,"prompt_chars_per_sec":237.02830188679246,"prompt_visible_match_rate":1,"visible_text_state_pass_rate":1,"first_output_to_bubble_p95_ms":122,"terminal_to_visual_p95_ms":1,"oracle_pass_rate":1,"cleanup_success_rate":1},"status":"keep","description":"Codex-style pet shell with row-based concurrent pets","timestamp":1777696960025,"segment":2,"confidence":35.30176817288801,"asi":{"hypothesis":"A floating Codex-like pet shell with a mascot badge and scrollable session rows preserves the multiple-pets concurrency model while matching the target desktop pet feel.","scoped_confirmation":"AGENT_UI_E2E_SCENARIOS=chrome-pdf-to-anki-study-pack AGENT_UI_E2E_MODE=serial produced ui_composite_score=88.40 and submit_to_cat_visible_p95_ms=289ms","benchmark_scope":"Scoped serial chrome-pdf-to-anki-study-pack","notable_change":"Replaced the full-screen wandering-cat canvas with a compact floating pet shell; each session now renders as a tray row with a shared mascot header."}}
{"run":16,"commit":"9865ef3","metric":88.25,"metrics":{"ui_composite_score":88.25,"workflow_success_rate":1,"typed_success_rate":1,"voice_success_rate":1,"shortcut_to_modal_p95_ms":170,"modal_focus_success_rate":1,"submit_to_cat_visible_p95_ms":294,"prompt_chars_per_sec":229.19042189281643,"prompt_visible_match_rate":1,"visible_text_state_pass_rate":1,"first_output_to_bubble_p95_ms":122,"terminal_to_visual_p95_ms":1,"oracle_pass_rate":1,"cleanup_success_rate":1},"status":"discard","description":"Initialize conversation before git snapshot to reduce submit-to-visible latency","timestamp":1777697264046,"segment":2,"confidence":15.269034670292317,"asi":{"hypothesis":"Registering the conversation before the git snapshot would let the UI/eval observe the new session sooner while still capturing the revert snapshot before Hermes starts.","rollback_reason":"Scoped primary score regressed from 88.40 to 88.25 and submit_to_cat_visible_p95_ms worsened from 289ms to 294ms, so the earlier snapshot ordering was not the dominant bottleneck for this workload.","next_action_hint":"Inspect latency-report for modal/submit path noise; try renderer-side or eval-click-target simplification rather than moving lifecycle ordering.","benchmark_scope":"AGENT_UI_E2E_SCENARIOS=chrome-pdf-to-anki-study-pack AGENT_UI_E2E_MODE=serial"}}
{"run":17,"commit":"9865ef3","metric":88.35,"metrics":{"ui_composite_score":88.35,"workflow_success_rate":1,"typed_success_rate":1,"voice_success_rate":1,"shortcut_to_modal_p95_ms":166,"modal_focus_success_rate":1,"submit_to_cat_visible_p95_ms":293,"prompt_chars_per_sec":231.30034522439587,"prompt_visible_match_rate":1,"visible_text_state_pass_rate":1,"first_output_to_bubble_p95_ms":122,"terminal_to_visual_p95_ms":1,"oracle_pass_rate":1,"cleanup_success_rate":1},"status":"discard","description":"Pass initial recent folder into modal query for faster selected-folder readiness","timestamp":1777697516283,"segment":2,"confidence":9.896783432474113,"asi":{"hypothesis":"Passing the first recent folder in the modal URL and rendering it synchronously would make the modal selected-folder oracle pass earlier without changing the real shortcut or folder-selection model.","rollback_reason":"Scoped primary score stayed below the kept 88.40 and shortcut/submit latencies were slightly worse than the current best, so the extra query plumbing did not produce a reliable gain.","next_action_hint":"Do not revisit initialFolder query unless a trace shows recent-folder IPC dominates; focus on submit-to-visible path or full-suite timeout reduction next.","benchmark_scope":"AGENT_UI_E2E_SCENARIOS=chrome-pdf-to-anki-study-pack AGENT_UI_E2E_MODE=serial"}}
